{
  "$schema": "https://json-schema.org/draft/2020-12/schema",
  "$id": "https://github.com/SemperSupra/model-artifact-foundry/schemas/model-request-v1.schema.json",
  "title": "Model Artifact Foundry Request v1",
  "type": "object",
  "additionalProperties": false,
  "required": [
    "schema_version",
    "capability",
    "target",
    "runtime",
    "representation",
    "envelope",
    "quality_policy"
  ],
  "properties": {
    "schema_version": {"const": 1},
    "capability": {
      "type": "object",
      "additionalProperties": false,
      "required": ["id", "interface"],
      "properties": {
        "id": {"type": "string", "minLength": 1},
        "interface": {"type": "string", "minLength": 1}
      }
    },
    "target": {
      "type": "object",
      "additionalProperties": false,
      "required": ["profile_id"],
      "properties": {
        "profile_id": {"type": "string", "minLength": 1}
      }
    },
    "runtime": {
      "type": "object",
      "additionalProperties": false,
      "required": ["offline_required", "allowed_ids"],
      "properties": {
        "offline_required": {"type": "boolean"},
        "allowed_ids": {
          "type": "array",
          "minItems": 1,
          "uniqueItems": true,
          "items": {"type": "string", "minLength": 1}
        }
      }
    },
    "representation": {
      "type": "object",
      "additionalProperties": false,
      "required": ["allowed_ids", "allowed_quantizations"],
      "properties": {
        "allowed_ids": {
          "type": "array",
          "minItems": 1,
          "uniqueItems": true,
          "items": {"type": "string", "minLength": 1}
        },
        "allowed_quantizations": {
          "type": "array",
          "minItems": 1,
          "uniqueItems": true,
          "items": {"type": "string", "minLength": 1}
        }
      }
    },
    "envelope": {
      "type": "object",
      "additionalProperties": false,
      "properties": {
        "max_peak_vram_gib": {"type": "number", "exclusiveMinimum": 0},
        "max_model_load_seconds": {"type": "number", "exclusiveMinimum": 0},
        "max_p95_query_latency_ms": {"type": "number", "exclusiveMinimum": 0}
      }
    },
    "quality_policy": {
      "type": "object",
      "additionalProperties": false,
      "required": ["id", "digest"],
      "properties": {
        "id": {"type": "string", "minLength": 1},
        "digest": {"type": "string", "pattern": "^sha256:[0-9a-f]{64}$"}
      }
    }
  }
}
